<?xml version="1.0" encoding="UTF-8"?>
<!--Sample XML file generated by XMLSpy v2011 sp1 (http://www.altova.com)-->
<artistTable xsi:schemaLocation="http://www.cs.sjsu.edu/cs157b/Artist artist.xsd" xmlns="http://www.cs.sjsu.edu/cs157b/Artist" xmlns:xsi="http://www.w3.org/2001/XMLSchema-instance">
	<artist>
		<artistid>1</artistid>
		<artistname>The Smashing Pumpkins</artistname>
	</artist>
	<artist>
		<artistid>2</artistid>
		<artistname>Nirvana</artistname>
	</artist>
		<artist>
		<artistid>3</artistid>
		<artistname>Stone Temple Pilots</artistname>
	</artist>
</artistTable>
